{
  "document_status": "DRAFT FOR REVIEW",
  "approval": "PENDING",
  "wbs_id": "QV-WRM-01",
  "quantqa_version": "QuantQA:v1",
  "full_git_sha": "d6ecd2d1bbf0ce78d6bbaa945ea5d15ea7a31570",
  "required_tier": "T1",
  "required_classes": [
    "S"
  ],
  "observed_classes": [
    "S"
  ],
  "status": "UNVERIFIED",
  "requirement_origin": {
    "required_classes": "QUANTQA_V1_IMPLEMENTATION_DEFINITION",
    "tier_label": "QUANTQA_V1_IMPLEMENTATION_DEFINITION"
  },
  "wbs_contract_ref": {
    "spreadsheet_id": "1V7SnG_x-cLIFbrSurDIadtx5GCY9HfL9jRqdyAl70Ks",
    "gid": 2030261433,
    "sheet": "2_WBS",
    "wbs_id": "QV-WRM-01",
    "row_number": 64,
    "observed_at": "2026-09-01T09:00:00+09:00"
  },
  "roles": {
    "owner": "윤서준",
    "executor": "윤서준",
    "reviewer": null,
    "approver": "조은채",
    "reviewer_approver_same_allowed_v1": true
  },
  "execution_boundary": {
    "scope": "LOCAL",
    "uses_mock": true,
    "uses_memory": true,
    "uses_noop": true,
    "configuration_environment_values_recorded": false,
    "secret_values_recorded": false,
    "production_node3_pve_load_performed": false,
    "effective_classes": [
      "S"
    ]
  },
  "evidence": [
    {
      "evidence_id": "QV-WRM-01-S-FIXED-COMMAND",
      "evidence_class": "S",
      "scenario": "Run the WBS row's fixed verification command at d6ecd2d.",
      "pass_criteria": "warm-up 미달 input에서 signal·performance unavailable",
      "actual_result": "exit_code=0 — 791 passed, 9 skipped, 1 warning in 28.73s",
      "validation_method": "cd ai && pytest -q (offline env per docs/evidence/_RUNNER.md)",
      "uses_mock": true,
      "uses_memory": true,
      "uses_noop": true,
      "exit_code": 0,
      "evidence_uri": "repo:docs/evidence/QV-WRM-01/d6ecd2d1bbf0ce78d6bbaa945ea5d15ea7a31570.md@d6ecd2d1bbf0ce78d6bbaa945ea5d15ea7a31570",
      "artifact_sha256": "4d30c9d8d110849c66f1a7de237e68bff438dc3c3efc894879ecc9f7c7caf3cb",
      "artifact_subject_sha": "d6ecd2d1bbf0ce78d6bbaa945ea5d15ea7a31570",
      "executor": "윤서준",
      "reviewer": null,
      "executed_at": "2026-08-28",
      "status": "UNVERIFIED",
      "limitations": [
        "Mock provider, in-memory job store and fixture inputs only; this is Static/Structural evidence and cannot establish Runtime.",
        "No reviewer has re-examined this artifact, so the evidence stays UNVERIFIED regardless of the exit code."
      ]
    },
    {
      "evidence_id": "QV-WRM-01-S-TARGETED-SUBSET",
      "evidence_class": "S",
      "scenario": "Run the subset of tests selected for QV-WRM-01.",
      "pass_criteria": "warm-up 미달 input에서 signal·performance unavailable",
      "actual_result": "exit=0 — 5 passed, 55 deselected in 0.21s",
      "validation_method": "cd ai && pytest -q tests/test_backtest_optimization.py tests/test_condition_vocabulary.py -k \"warmup or warm_up or window\"",
      "uses_mock": true,
      "uses_memory": true,
      "uses_noop": true,
      "exit_code": 0,
      "evidence_uri": "repo:docs/evidence/QV-WRM-01/d6ecd2d1bbf0ce78d6bbaa945ea5d15ea7a31570.md@d6ecd2d1bbf0ce78d6bbaa945ea5d15ea7a31570",
      "artifact_sha256": "4d30c9d8d110849c66f1a7de237e68bff438dc3c3efc894879ecc9f7c7caf3cb",
      "artifact_subject_sha": "d6ecd2d1bbf0ce78d6bbaa945ea5d15ea7a31570",
      "executor": "윤서준",
      "reviewer": null,
      "executed_at": "2026-08-28",
      "status": "UNVERIFIED",
      "limitations": [
        "Same Static-only boundary as the fixed-command item above."
      ]
    }
  ],
  "limitations": [
    "T1/S is a QuantQA:v1 implementation assignment. The Google Sheet does not state a class or tier for this row, so a reviewer may contest it.",
    "Every command was run locally with secrets unset and mock/memory/noop enabled, which QuantQA:v1 section 4 confines to class S.",
    "The evidence bundle is Markdown; this manifest is derived from it and adds no observation of its own.",
    "The bundle's acceptance-axis table is not filled in, so no per-axis mapping from the Done contract to individual tests exists yet.",
    "This manifest records no configuration or environment values, per QuantQA:v1 section 5. The referenced bundle's runner note (docs/evidence/_RUNNER.md) does list the non-secret offline switches used (AUTH_ENABLED, AI_LLM_PROVIDER, AI_JOB_STORE, AI_AUDIT_SINK) and the names of the variables unset. No secret values appear anywhere. A reviewer applying section 5 strictly may still judge those switches to be configuration values that do not belong in an artifact."
  ],
  "blockers": [
    "No reviewer is assigned. QuantQA:v1 requires reviewer != owner and reviewer != executor; the owner and executor are both 윤서준.",
    "QuantQA:v1 itself is not an approved contract (section 9 lists five open decisions, including whether reviewer and approver may be the same person).",
    "Acceptance-axis mapping is missing, so a reviewer has no per-criterion basis to judge."
  ]
}
