{
  "document_status": "DRAFT FOR REVIEW",
  "approval": "PENDING",
  "wbs_id": "FT-RLS-01",
  "quantqa_version": "QuantQA:v1",
  "full_git_sha": "d6ecd2d1bbf0ce78d6bbaa945ea5d15ea7a31570",
  "required_tier": "T3",
  "required_classes": [
    "S",
    "R",
    "O"
  ],
  "observed_classes": [
    "S"
  ],
  "status": "UNVERIFIED",
  "requirement_origin": {
    "required_classes": "QUANTQA_V1_IMPLEMENTATION_DEFINITION",
    "tier_label": "QUANTQA_V1_IMPLEMENTATION_DEFINITION"
  },
  "wbs_contract_ref": {
    "spreadsheet_id": "1V7SnG_x-cLIFbrSurDIadtx5GCY9HfL9jRqdyAl70Ks",
    "gid": 2030261433,
    "sheet": "2_WBS",
    "wbs_id": "FT-RLS-01",
    "row_number": 19,
    "observed_at": "2026-09-01T09:00:00+09:00"
  },
  "roles": {
    "owner": "윤서준",
    "executor": "윤서준",
    "reviewer": null,
    "approver": "조은채",
    "reviewer_approver_same_allowed_v1": true
  },
  "execution_boundary": {
    "scope": "LOCAL",
    "uses_mock": true,
    "uses_memory": true,
    "uses_noop": true,
    "configuration_environment_values_recorded": false,
    "secret_values_recorded": false,
    "production_node3_pve_load_performed": false,
    "effective_classes": [
      "S"
    ]
  },
  "evidence": [
    {
      "evidence_id": "FT-RLS-01-S-FIXED-COMMAND",
      "evidence_class": "S",
      "scenario": "Run the WBS row's fixed verification command at d6ecd2d.",
      "pass_criteria": "no DSN이면 ready·추천·양수 metric이 절대 나오지 않음",
      "actual_result": "exit_code=0 — 791 passed, 9 skipped, 1 warning in 28.73s",
      "validation_method": "cd ai && pytest -q (offline env per docs/evidence/_RUNNER.md)",
      "uses_mock": true,
      "uses_memory": true,
      "uses_noop": true,
      "exit_code": 0,
      "evidence_uri": "repo:docs/evidence/FT-RLS-01/d6ecd2d1bbf0ce78d6bbaa945ea5d15ea7a31570.md@d6ecd2d1bbf0ce78d6bbaa945ea5d15ea7a31570",
      "artifact_sha256": "fa29c373cc4ffaab0b570d01bcd587ea0f6659ad8977f44f742456c08e628545",
      "artifact_subject_sha": "d6ecd2d1bbf0ce78d6bbaa945ea5d15ea7a31570",
      "executor": "윤서준",
      "reviewer": null,
      "executed_at": "2026-08-28",
      "status": "UNVERIFIED",
      "limitations": [
        "Mock provider, in-memory job store and fixture inputs only; this is Static/Structural evidence and cannot establish Runtime.",
        "No reviewer has re-examined this artifact, so the evidence stays UNVERIFIED regardless of the exit code."
      ]
    },
    {
      "evidence_id": "FT-RLS-01-S-TARGETED-SUBSET",
      "evidence_class": "S",
      "scenario": "Run the subset of tests selected for FT-RLS-01.",
      "pass_criteria": "no DSN이면 ready·추천·양수 metric이 절대 나오지 않음",
      "actual_result": "exit=0 — 25 passed, 1 warning in 1.85s",
      "validation_method": "cd ai && pytest -q tests/test_api.py::test_release_readiness_requires_durable_job_store_before_other_dependencies tests/test_db_data_source.py::test_pipeline_data_source_without_dsn_uses_explicit_nonproduction_fixture tests/test_graph_e2e.py::test_rsi_strategy_runs_ready_e2e_without_external_keys tests/test_live_provider_fail_closed.py",
      "uses_mock": true,
      "uses_memory": true,
      "uses_noop": true,
      "exit_code": 0,
      "evidence_uri": "repo:docs/evidence/FT-RLS-01/d6ecd2d1bbf0ce78d6bbaa945ea5d15ea7a31570.md@d6ecd2d1bbf0ce78d6bbaa945ea5d15ea7a31570",
      "artifact_sha256": "fa29c373cc4ffaab0b570d01bcd587ea0f6659ad8977f44f742456c08e628545",
      "artifact_subject_sha": "d6ecd2d1bbf0ce78d6bbaa945ea5d15ea7a31570",
      "executor": "윤서준",
      "reviewer": null,
      "executed_at": "2026-08-28",
      "status": "UNVERIFIED",
      "limitations": [
        "Same Static-only boundary as the fixed-command item above."
      ]
    }
  ],
  "limitations": [
    "T3/S+R+O is a QuantQA:v1 implementation assignment. The Google Sheet does not state a class or tier for this row, so a reviewer may contest it.",
    "Every command was run locally with secrets unset and mock/memory/noop enabled, which QuantQA:v1 section 4 confines to class S.",
    "The evidence bundle is Markdown; this manifest is derived from it and adds no observation of its own.",
    "This manifest records no configuration or environment values, per QuantQA:v1 section 5. The referenced bundle's runner note (docs/evidence/_RUNNER.md) does list the non-secret offline switches used (AUTH_ENABLED, AI_LLM_PROVIDER, AI_JOB_STORE, AI_AUDIT_SINK) and the names of the variables unset. No secret values appear anywhere. A reviewer applying section 5 strictly may still judge those switches to be configuration values that do not belong in an artifact."
  ],
  "blockers": [
    "No reviewer is assigned. QuantQA:v1 requires reviewer != owner and reviewer != executor; the owner and executor are both 윤서준.",
    "QuantQA:v1 itself is not an approved contract (section 9 lists five open decisions, including whether reviewer and approver may be the same person).",
    "Required classes R+O have no evidence: no non-mock runtime, isolated staging, or approved CI run exists at d6ecd2d."
  ]
}
